{"artifact_manifest":{"artifacts":[{"content_hash":"sha256:03dc640d7cc87b48c2dd54e1d97dacff32997eb001df544c0166aadd59ef48f9","id":"artifact.source_definition","media_type":"text/plain","path":"fixtures/phase0/source/even-definition.txt"},{"content_hash":"sha256:d84513a4ea903eb3bc4f7a6b5434785b4d211af847ca3a5c2e2c4f395940b5a0","id":"artifact.failed_route","media_type":"text/plain","path":"fixtures/phase0/source/failed-route.txt"},{"content_hash":"sha256:c24bb21531ddf062375443a64e04e1d7a460611cef2198dd6cf6e69b08fca4f3","id":"artifact.proposer_narrative","media_type":"text/plain","path":"fixtures/phase0/source/proposer-narrative.txt"}],"id":"manifest.even_sum.v1"},"budget":{"external_processes":1,"wall_seconds":30},"capabilities":["deterministic_json","local_file_source","subprocess_probe"],"claims":[{"assumption_claim_ids":[],"id":"claim.even_definition","kind":"definition","origin":"source","statement":"An integer n is even iff there exists an integer k such that n = 2k.","truth_status":"unknown","warrants":[]},{"assumption_claim_ids":["claim.even_definition"],"id":"claim.even_sum","kind":"theorem","origin":"user","statement":"For all integers a and b, if a and b are even, then a + b is even.","truth_status":"unknown","warrants":[]},{"assumption_claim_ids":["claim.even_definition"],"id":"claim.integer_to_why3_encoding","kind":"equivalence","origin":"tool","statement":"The dossier integer/even notation is represented by Why3 int and the predicate exists k:int. n=2*k.","truth_status":"unknown","warrants":[]}],"content_hash":"sha256:7feee534fc70bf082846f1306d6e9ac652b136f0ba91eda10b1f085a9a057fbf","dossier_id":"dossier.even_sum.v1","evaluation_protocol":{"frozen_at":"2026-08-19T00:00:00Z","frozen_by":"actor.phase0_owner","id":"evaluation.phase0.reference.v1","metrics":["target_fidelity","applicability_separation","trace_retention","replay_determinism","wall_time_ms"],"phase":"exploratory","stopping_rules":["One bounded run and one replay per component","No network installation"],"success_criteria":["File baseline round-trips without semantic loss","Every missing integration emits a blocker"],"version":1},"failed_routes":[{"artifact_ids":["artifact.failed_route"],"failure_reason":"Finite testing cannot establish an unrestricted universal theorem.","id":"failed_route.finite_sampling","status":"failed","strategy":"Check finitely many integer pairs and claim universal proof.","target_claim_id":"claim.even_sum"}],"formalization":{"approval_status":"approved","assumptions":["claim.even_definition"],"formal_language":"informal_math","id":"formalization.even_sum.v1","problem_id":"problem.even_sum","quantifiers":["forall a in Z","forall b in Z"],"statement":"For every a,b in Z, (exists k in Z, a=2k) and (exists l in Z, b=2l) implies exists m in Z, a+b=2m.","target_claim_id":"claim.even_sum","version":1},"open_obligations":[{"category":"logical_gap","claim_id":"claim.even_sum","description":"Provide a complete derivation or formal proof of the target.","id":"obligation.proof","status":"open"},{"category":"literature_applicability","claim_id":"claim.even_definition","description":"Check that the cited definition uses the same integer domain and local meaning of even.","id":"obligation.source_applicability","status":"open"},{"category":"representation_bridge","claim_id":"claim.integer_to_why3_encoding","description":"Verify that the Why3 encoding preserves integer multiplication, addition, and existential quantification.","id":"obligation.why3_bridge","status":"open"}],"problem":{"id":"problem.even_sum","informal_statement":"For all integers a and b, if a and b are even, then a + b is even.","problem_type":"prove","statement_hash":"sha256:f24381d9c42f5a34579eb2d1508dee8133bf05fdc456ad2850574d1b98e439fc","title":"Sum of two even integers","version":1},"representation_maps":[{"bridge_obligation_ids":["obligation.why3_bridge"],"encoding_claim_id":"claim.integer_to_why3_encoding","exceptional_case_claim_ids":[],"id":"representation_map.why3","preserved_property_claim_ids":[],"source":"informal integer arithmetic","status":"proposed","target":"Why3 int theory"}],"schema_version":"0.1.0-phase0","semantic_alignment":{"approved_by":"actor.reference_reviewer","assumption_delta":[],"compared_claim_id":"claim.even_sum","definition_mapping":{"even":"exists integer k such that n = 2k"},"edge_case_delta":[],"formalization_id":"formalization.even_sum.v1","id":"alignment.even_sum.v1","problem_id":"problem.even_sum","quantifier_mapping":{"a":"integer a","b":"integer b"},"status":"researcher_approved","strength_relation":"equivalent"},"source_cards":[{"applicability_status":"unresolved","bibliographic_status":"confirmed","definition_correspondences":[],"id":"source_card.even_definition","implication_obligation_id":"obligation.source_applicability","imported_hypotheses":["n is an integer"],"imported_statement":"An integer n is even when there exists an integer k such that n = 2k.","local_claim_id":"claim.even_definition","scope_and_exceptions":["Integers only"],"source_span":{"content_hash":"sha256:03dc640d7cc87b48c2dd54e1d97dacff32997eb001df544c0166aadd59ef48f9","document_id":"document.local_even_definition","id":"span.even_definition","locator":"line 1","parser_name":"manual-reference-fixture","parser_version":"1","raw_content":"Definition 1. An integer n is even when there exists an integer k such that n = 2k."}}],"verifier_context_manifest":{"candidate_artifact_ids":[],"excluded_artifact_ids":["artifact.proposer_narrative"],"id":"verifier_context.even_sum.v1","isolation_policy_id":"policy.exclude_proposer_narrative.v1","premise_claim_ids":["claim.even_definition"],"serialized_context_hash":"sha256:b18d159aa795ed55f014e83076c2a9321789bf0f9ad90b005aaae92aec83ed7c","source_span_ids":["span.even_definition"],"target_claim_ids":["claim.even_sum"]}}
